{
  "version": 0,
  "input_buffer_seconds": 0.45,
  "command_retarget_grace_seconds": 0.22,
  "movement_smoothing": {
    "catch_up_speed": 14.0,
    "max_offset": 0.8,
    "settle_epsilon": 0.01
  },
  "melee_lunge": {
    "distance": 0.18,
    "recovery_seconds": 0.12,
    "settle_epsilon": 0.01
  },
  "level_loading_min_display_seconds": 0.55,
  "attack_animation": {
    "enabled": true,
    "baseline_attack_speed": 1.0,
    "min_speed_scale": 0.75,
    "max_speed_scale": 2.5
  },
  "enemy_impact_feedback": {
    "enabled": true
  }
}
